Job Title,Company,Link,Job_Description,Location,Job_Rec
Software Development Analyst - Automation,Meta Data Technologies Pvt Ltd,https://www.freshersworld.com/jobs/software-development-analyst-automation-jobs-in-chennai-meta-data-technologies-pvt-ltd-1009987,", NTT DATA Services strives to hire exceptional, innovative and passionate individuals who want to grow with us. If you want to be part of an inclusive, adaptable, and forward-thinking organization, apply now.We are currently seeking a Software Development Analyst - Automation Anywhere to join our team in Chennai, Tamil Nādu (IN-TN),India (IN).In These Roles, You Will Be Responsible ForAnalyzing requirements and creating script.Provide advanced technical support for investigation and diagnosis for resolving tickets related incidents to ensure Service Level Agreements/Operational Level Agreements are compiled.Delivering a high-quality applicationProblem solving issues that arise in day to day issues and providing timely responses and solutions as required.Required Skills For This Role IncludeTechnical skillsOverall IT Experience: Min 6 years, of which Min 4 years in Automation Anywhere.Experience in developing Automations in: Automation Anywhere and any RPA PlatformBasic knowledge of .Net skills and Web service ConceptGood knowledge in SQL ServerInterest to learn other RPA platforms.Ability to both understand a business process from a workflow diagramWillingness and ability to blend business analysis with hands-on configuration of automated processes in the Automation Software Products.Desired Skills:Domain Knowledge: Finance &amp; AccountingPreferencesGraduate degree in Computer Science with 6 to 8 years of IT / Automation development.Willing to work on shiftTravelThis position might have travel requirement.Job SummaryJob Type : Full TimeJob Role : IT Software-EngineerJob Category : IT/Software,DiplomaHiring Process :  Face to Face InterviewWho can apply : Freshers and Experienced (0 to 3 yrs )",chennai,data scientist
Sales Development Representative,CustomerLabs No Code Customer Data Platform,https://www.freshersworld.com/jobs/sales-development-representative-jobs-in-chennai-customerlabs-no-code-customer-data-platform-1012114,", We’re looking for an energetic sales representative to actively seek out and engage customer prospects. You will provide appropriate solutions for every customer in order to drive revenue growth, and add new customers.Responsibilities:Demo and sell products to existing and prospective customersEstablish and maintain positive business and customer relationshipsReach out to customer leads through phone, email as required.Solve customer problems and complaints to maximize satisfactionAchieve sales targets and outcomes.Collaborate within team members and other departmentsGenerate reports on new sale, target achievements, issues to the management.Get feedback and improve constantly.Requirements:Proven work experience as a sales representativeFluency in MS OfficeFamiliarity with CRMs practices.Highly motivated and target driven with a proven track record in salesExcellent selling, communication and negotiation skillsPrioritizing, time management and organizational skillsAbility to create and deliver presentations tailored to the audience needsRelationship management skills and openness to feedbackBS/BA degree or equivalentJob SummaryJob Type : Full TimeJob Role : Sales / Marketing ExecutiveJob Category : Diploma,Sales and MarketingHiring Process :  Face to Face InterviewWho can apply : Freshers and Experienced (0 to 3 yrs )",chennai,data scientist
Field Investigator,Market Xcel Data Matrix Pvt Ltd,https://www.freshersworld.com/jobs/field-investigator-jobs-in-dewas-shahdol-market-xcel-data-matrix-pvt-ltd-1013970,", We are looking for a field investigator to develop sales strategies and attract new clients. The field investigator will play a key role in increasing income and revenue by acquiring more and more clients, generating leads and managing sales of products and services. He will be responsible for the following tasks:-Perform daily field tasks
assigned by client (Field Investigator to receive task using PMS software)Panel home recruitmentMeter Installation
as per planMaintenance and Servicing of Panel homesRequirements and QualificationsAny bachelor’s degree or related
diploma Good sales experienceMinimum 2 year experience in field related tasks from
any industryAbility to
communicate in local language Willingness to
travel Tech savy: should
be well conversant in operating smart phone/tab/laptop/ any new gadgetsAge limit up to 30
yearsStability in
careerJob SummaryJob Type : Full TimeJob Role : Sales / Marketing ExecutiveJob Category : OthersHiring Process :  Face to Face Interview, Telephonic InterviewWho can apply : Experienced (2 to 3 yrs)",chennai,data scientist
Market Research,ARU Research,https://www.freshersworld.com/jobs/market-research-jobs-in-chennai-aru-research-997849,", Collecting data on consumers, competitors, and market place and consolidating information into actionable items, reports, and presentationsUnderstanding business objectives and designing surveys to discover prospective customers’ preferencesCompiling and analyzing statistical data using modern and traditional methods to collect it.Job SummaryJob Type : Full TimeJob Role : Research/JRF/SRFJob Category : OthersHiring Process :  Face to Face Interview, Telephonic InterviewWho can apply : Freshers",chennai,data scientist
Training Content Developer,Alation,https://www.freshersworld.com/jobs/training-content-developer-jobs-in-chennai-alation-1009959,", Job ScopeProduce technical training content - must have proven ability to write content about data concepts, products and technologiesProduce content developed and written by others, including eLearning production, video post-production, audio clean up and related tasksCreate training material using designs and outlines created by othersCreate, deploy and evaluate student experience assets (LMS courses or pages, assessment activitiesCreate the final polish for all customer-delivered content by using extraordinary attention-to-detailUnderstand the data ecosystem and the data catalog to ensure the best content deliveryResponsibilities: Produce and maintain training assetsDevelop technical eLearning content using modern production tools (Articulate, Captivate, Camtasia) about a data software product, a data catalogPerform regular production tasks on eLearning assets (edit videos, produce LMS compatible outputs, integrate media and interactions)Organize and manage training assets for internal use with the training departmentOrganize and manage training assets for accepted use by co-workers from other departmentsCreate and maintain systems, processes and communications to curate content, encouraging others to build and share their wisdom.Responsibilities: Build the training content library Write training content for eLearning or Instructor led training materialApply instructional design and learning theory concepts to create useful, engaging, fun training experiencesCurate training material from multiple sources to provide fast paths to training solutionsDevelop expertise in Alation’s productMaintain training material. Review product changes and apply changes to content where needed.Required Experience/SkillsTechnical competency - a fundamental understanding of data, with at least 1-2 years experience building training for a technical audience such as administrators or developers. Technical skills may include databases, analytical tools, scripting languages, HTML, CSS, SQL, APIs and integration, networking, storage.3-5 years experience writing training or documentation. Writing Samples will be required. 2 years experience building technical training content for software or hardware customersYou must complete a short sample exercise in order to be considered for this position.Knowledge of instructional design and earning theoryDemonstrated experience and proficiency with eLearning tools (examples: Articulate 360, Articulate Presenter, Techsmith Camtasia, Adobe Captivate)Excellent writing skills. You will be the model for the company – your writing must be correct.Imagination and creativity. We have fun working, and want our customers to have fun learning.More About AlationOur founders have come together from different backgrounds: business, engineering, and design. This unique mix from our founding team is important to the Alation culture story. Today, our team consists of creators and communicators with varied backgrounds - from Stanford, to the Indian Institute of Technology, big companies and one-person startups, the United States, and abroad. We continue to seek ever more diverse perspectives as we grow.Why Alation? Market-Leading Data Catalog Provider High-growth, collaborative environment with diverse and inclusive teams Continuous learning, enrichment and development opportunities Competitive pay and health offerings Flexible time off to relax and rechargeJob SummaryJob Type : Full TimeJob Role : IT Software-EngineerJob Category : IT/Software,DiplomaHiring Process :  Face to Face InterviewWho can apply : Experienced (3 to 3+ yrs)",chennai,data scientist
Software Developer,Redink,https://www.freshersworld.com/jobs/software-developer-jobs-in-chennai-redink-995509,",  Skills Required :-Backend:1) Experience in Node.js2) Java language is mandatoryExperience required : 3yrs. Job Description :-Collaborate with Front-end developers Define and communicate technical and design requirementsProvide training, help and support to other team membersDevelop functional and sustainable web applications with clean codesTroubleshoot and debug applicationsLearn about new technologiesFollow new and emerging technologiesConduct UI tests and optimize performanceJob SummaryJob Type : Full TimeJob Role : IT Software-EngineerJob Category : IT/Software,Work from HomeHiring Process :  Telephonic InterviewWho can apply : Experienced (3 yrs)",chennai,data scientist
DevOps Trainer,Intellipaat,https://www.freshersworld.com/jobs/devops-trainer-jobs-in-chennai-intellipaat-993975,",  Looking for a trainer who Done DevOps Certification in Chennai and having industry experience of min 2 years. The candidate who is applying for the job should be good at the following:• Fluency in English • Good teaching skills • Should have domain knowledge • Should know about DevOps with its applications • DevOps ToolsExcellent communication skillsExcellent presentation skills Experience in corporate training's Excellent knowledge of DevOps tools Handle Online sessions and also classroom sessions.Job SummaryJob Type : Full TimeJob Role : Teacher / TrainerJob Category : TeachingHiring Process :  Face to Face Interview, Telephonic InterviewWho can apply : Experienced (2 yrs)",chennai,data scientist
Relationship Manager,A2Z Finders,https://www.freshersworld.com/jobs/relationship-manager-jobs-in-kochi-chennai-hyderabad-a2z-finders-1010214,",  Job Description will be as the designation says in one of our renowned clients for the post of Relationship Manager in the Insurance Industry. Our Client is a Leader in the Insurance Industry. We are looking to refer Young, Energetic &amp; Dynamic professionals to join our team as Relationship Manager.Candidates applying for this job should have at least 3 years of prior experience in the same roleJob SummaryJob Type : Full TimeJob Role : Customer Service / Tech SupportJob Category : Diploma,Tech SupportHiring Process :  Face to Face InterviewWho can apply : Experienced (3 yrs)",chennai,data scientist
Medical Coding,Core2Code Healthcare Services,https://www.freshersworld.com/jobs/medical-coding-jobs-in-bangalore-chennai-hyderabad-core2code-healthcare-services-998281,",  We are hiring 2016-2020 Fresh Graduates preferably from the Life Science stream for our new project in Medical Coding.Medical Coding is a system based job working with patients medical reports to analyze and convert them to numerical codes for billing purpose.The US HIPAA Privacy Rule signed by Bill Clinton in 1996, protects most “individually identifiable health information” held or transmitted by a covered entity or its business associate, in any form or medium, whether electronic, on paper, or oral. The Privacy Rule calls this information protected health information (PHI).Medical Coder plays an important part in the field of Healthcare to maintain the standards of PHI. According to the Bureau of Labor and Statistics, the medical billing and coding field is expected to grow by 15% between now and 2024. That's almost 30,000 job openings in the next seven-year.Benefits of Medical Coding Job:1. Salary: 14k to 20k for Entry Level Coders2. Salary Growth: 3k to 5k (6 months to yearly)3. Excellent knowledge growth in the field of healthcare4. Health Insurance Coverage5. Food Coupons6. Incentives and Gifts for outstanding performance7. Opportunity to work Globally Job SummaryJob Type : Full TimeJob Role : Nurse / HealthcareJob Category : BSc/BCA/BBM,Health Care,Work from HomeHiring Process :  Telephonic InterviewWho can apply : Freshers",chennai,data scientist
UI/UX Developer / Senior Developer,Falaina,https://www.freshersworld.com/jobs/ui-ux-developer-senior-developer-jobs-in-chennai-falaina-1004844,", Company Name: Falaina Pte. Ltd.Role: UI/UX Developer / Senior Developer, Chennai Department: Technology and InnovationLocation: Chennai, IndiaTechnology and Innovation Team @ FàlainaTechnology and Innovation (Research &amp; Development) team at Fálaina is a strategic and critical innovation team, combining software engineering excellence with thought leadership and entrepreneurial spirit. Technology and Innovation team pioneers’ innovative solutions within identity and data security. To ensure a successful go-to-market, the Technology and Innovation team members follow an end-to-end responsibility approach.Senior Developer / Module Lead (.Net) - Job Description As a member of the Technology and Innovation team, you will work together with a team of dedicated experts including researchers, designer, developers, and architects with a single goal of building most innovative identity and data security technologies for a variety of use cases spanning across all industries. You will work against fixed timelines and your success will be measured by the ability to deliver on time on target products/solutions based on company directions. Your tasks include:Responsible for plan and implement new designs &amp; optimize existing user interface designsResponsible for development of product UI user experience.Fálaina Job DescriptionProducing high quality UX design solutions through wireframes, visual and graphic designs, flow diagrams, storyboards, site maps, and prototypes.Designing UI elements and tools such as navigation menus, search boxes, tabs, and widgets for our digital assets.Create prototypes for new product ideas &amp; Combine creativity with an awareness of the design elementsEnsure the performance, quality, and responsiveness of applicationsCollaborate with customer and team to define, design, and ship new featuresEffort estimates for the individual featuresAs an on-going process, create and maintain technical and functional documents for application.Work with Senior Developer/Lead Architect on product development across all product development life cycle.To participate in critical customer proof of concepts activities to help to win customer confidence and guide sales/pre-sales team members.Required to travel from time to time to attend conferences,customer/partner meetings, and to participate in company marketing events.Skillset: Adobe Creative Suite. (Adobe XD, Photoshop, illustrator)Sketch, InVision, Visio,HTML, CSS (SCSS),iOS, Android, Design SystemsKnowledge in .NET Technology is added advantage.Must have very good communication skill.Experience in using “Telerik” web control will be plus.Experience with Visual Studio 2019 will be plus.Experience with Agile Methodologies.Ability to handle multiple assignments at the same time and prioritize tasks.Creative thinking for providing innovative solutions.Experience with Azure DevOps and Git.Experience in Identity and Access Management is added advantage.Junior Technical/Quality Assurance Required Education and Experience Bsc. Computer Science/Information Technology/Engineering or Higher or equivalent or Equivalent Diploma5 to 10 years of experience in Information Technology or Information SystemsJob SummaryJob Type : Full TimeJob Role : IT Software-EngineerJob Category : IT/Software,DiplomaHiring Process :  Face to Face InterviewWho can apply : Experienced (3+ yrs)",chennai,data scientist
Sales Operations Support Specialist,Hitachi ABB Power Grids,https://www.freshersworld.com/jobs/sales-operations-support-specialist-jobs-in-chennai-hitachi-abb-power-grids-1019449,",  Hitachi ABB Power Grids is a pioneering technology leader that is helping to increase access to affordable, reliable, sustainable and modern energy for all. We help to power your home, keep the factories running, and our hospitals and schools open. Come as you are and prepare to get better as you learn from others. Bring your passion, bring your energy, and plug into a team that appreciates a simple truth: Diversity + Collaboration = Great InnovationThe Hitachi ABB Power Grids Operations Center (INOPC) is a competence center with around 900 skilled engineers who focus on tendering, engineering, planning, procurement, functional system testing, installation supervision and commissioning. However, over the last decade, it has evolved to become the largest engineering hub. The India Operations Centre is a key aspect of the Power Grids business Power Up transformation program. The INOPC team at Chennai supports Hitachi ABB Power Grid’s units in more than 25 countries across a wide portfolio of all the four business units in Power Grid business. To date, the team has executed engineering and commissioning for projects in more than 60 countries.Your ResponsibilitiesFCM File management.Administrating &amp; Operating MS Team for the HUB.Support factories to increase the usage of MS Teams.Monitoring data quality &amp; taking steps to improve the data quality.Supporting the sales operations team.Using of tools like – PowerBI, Advanced excel, SharePoint to create reports.Develop dashboard &amp; reports for demand side and supply factories.Implementation of Configurators for the HUB.Providing training to users for SFDC.Living core values of safety and integrity, which means taking responsibility for your own actions while caring for your colleagues and the business.Your backgroundBachelor’s degree from a reputed university.2-4 Years of experience, with a combination of engineering and/or Sales Operation/Analytics.Basic understanding of electrical and mechanical systems.Knowledge in Salesforce, PowerBI, SharePoint.Proficiency with CRM and BI tool landscape.Excellent command over English and preferable if have knowledge of French language.True team player.Marketing and Sales acumen (with previous customer-facing experience preferably).Ability to perform data entry for proposals &amp; orders using internal tools.Proven development and maintenance of positive, cooperative, team-oriented relationships with co-workers, supervisors, managers, clients and others in contact with the job.Job SummaryJob Type : Full TimeJob Role : Sales / Marketing ExecutiveJob Category : Sales and MarketingHiring Process :  Face to Face InterviewWho can apply : Experienced (2 to 3+ yrs)",chennai,data scientist
Technical Trainer Java .NET,Worksbot Applicaions Pvt ltd,https://www.freshersworld.com/jobs/technical-trainer-java-net-jobs-in-chennai-worksbot-applicaions-pvt-ltd-1002904,", To train Academics / Corporate Professionals in JAVA .NET Technologies.To create customized Contents, Teaching Aids, Problems Solutions and Case Studies.To conduct and Evaluate assessments.To generate Training reportsDesired Candidate ProfileAny Degree related to Computer Science with 1 to 3 years of relevant training experienceStrong knowledge in Advance Java / Advance .NETExperience in training college students added advantageCreative, with strong interpersonal, presentation skillsStrong communication skills (active listening, speaking and writing)Advanced delivery skills including training, facilitating, and mentoring capabilityQuick learner with technical aptitude (ability to learn new technologies with ease).Job SummaryJob Type : Full TimeJob Role : Teacher / TrainerJob Category : Teaching,1 to 3 Yr ExpHiring Process :  Face to Face InterviewWho can apply : Experienced (1 to 3 yrs)",chennai,data scientist
Assistant Professor - Hepatology,Sri Ramachandra University,https://www.freshersworld.com/jobs/assistant-professor-hepatology-jobs-in-chennai-sri-ramachandra-university-1003259,", Sri Ramachandra University Invite Applications For The Post of Assistant Professor - HepatologyJob Description : Assistant Professor – HepatologyExperience : 0 - 1 year in reputed Medical CollegeEssential Qualifications : DM (Hepatology)Salary : As per Institution NormsJob SummaryJob Type : Full TimeJob Role : Teacher / TrainerJob Category : Teaching,1 to 3 Yr ExpHiring Process :  Face to Face InterviewWho can apply : Freshers and Experienced (0 to 1 yrs )",chennai,data scientist
Tamil Speaker,Appen,https://www.freshersworld.com/jobs/tamil-speaker-jobs-in-chennai-appen-989583,", Interested in transcribing audios following specific
guidelines and writing conventions? This project might be for you! Check it
out.Requirements:  • Native speaker of Tamil• Residing in IndiaSteps on how to register:1. Choose Tamil (India) as your primary language.  2. Complete the Registration page and click the Submit
Application button to create your account.3. Once you passed the qualification process, kindly to go
‘All Project’ tab and look for Project ‘Tapti’.4. Click the ‘Learn More’ or ‘Qualify’ button on the right
side to start your qualification for the project. Do not miss the chance to earn extra income working from the
comfort of your own home. This is a great opportunity for you and your friends! • Work from home with flexible hours• You can work on our projects around your other jobs• Appen is ranked as top 1 out of 100 companies offering
remote jobs by Flexjobs.com We are an equal opportunity employer and value diversity at
our company. We do not discriminate based on race, religion, color, national
origin, gender, sexual orientation, age, marital status, veteran status, or disability
status. Thank you and we hope to work with you soon!Job SummaryJob Type : Part TimeJob Role : Customer Service / Tech SupportJob Category : Tech SupportHiring Process :  Written-test, Telephonic InterviewWho can apply : Freshers",chennai,data scientist
